[
  {"question_id":"GAKAO-MAT-2026-000001","exam":"GAKAO","exam_year":2026,"subject":"Mathematics","chapter":"Algebra","topic":"Inequalities","difficulty":"Medium","question_type":"MCQ","question_text":"If x is a positive real number and x + 1/x = 5, then x^2 + 1/x^2 equals:","options":["21","23","25","27"],"correct_answer":"23","marks":4,"negative_marks":1,"source":"Study Buddy Original","source_reference":"stage-1-original-bank","tags":["algebra","inequalities"],"content_type":"original_exam_style","rights_status":"study_buddy_owned","redistribution_allowed":true,"rights_holder":"Study Buddy","license":"Study Buddy original content"},
  {"question_id":"GAKAO-MAT-2026-000002","exam":"GAKAO","exam_year":2026,"subject":"Mathematics","chapter":"Combinatorics","topic":"Counting","difficulty":"Hard","question_type":"MCQ","question_text":"How many two-digit positive integers have distinct digits and are divisible by 5?","options":["9","10","17","18"],"correct_answer":"17","marks":4,"negative_marks":1,"source":"Study Buddy Original","source_reference":"stage-1-original-bank","tags":["counting","combinatorics"],"content_type":"original_exam_style","rights_status":"study_buddy_owned","redistribution_allowed":true,"rights_holder":"Study Buddy","license":"Study Buddy original content"},
  {"question_id":"GAKAO-MAT-2026-000003","exam":"GAKAO","exam_year":2026,"subject":"Mathematics","chapter":"Number Theory","topic":"Divisibility","difficulty":"Medium","question_type":"MCQ","question_text":"If an integer n is divisible by 6 and by 8, then n must be divisible by:","options":["12","18","24","48"],"correct_answer":"24","marks":4,"negative_marks":1,"source":"Study Buddy Original","source_reference":"stage-1-original-bank","tags":["number-theory","divisibility"],"content_type":"original_exam_style","rights_status":"study_buddy_owned","redistribution_allowed":true,"rights_holder":"Study Buddy","license":"Study Buddy original content"},
  {"question_id":"GAKAO-MAT-2026-000004","exam":"GAKAO","exam_year":2026,"subject":"Mathematics","chapter":"Algebra","topic":"Quadratic Roots","difficulty":"Medium","question_type":"MCQ","question_text":"If the roots of x^2 - 6x + 8 = 0 are alpha and beta, then alpha beta is:","options":["2","4","6","8"],"correct_answer":"8","marks":4,"negative_marks":1,"source":"Study Buddy Original","source_reference":"stage-1-original-bank","tags":["algebra","quadratic"],"content_type":"original_exam_style","rights_status":"study_buddy_owned","redistribution_allowed":true,"rights_holder":"Study Buddy","license":"Study Buddy original content"},
  {"question_id":"GAKAO-MAT-2026-000005","exam":"GAKAO","exam_year":2026,"subject":"Mathematics","chapter":"Combinatorics","topic":"Arrangements","difficulty":"Hard","question_type":"MCQ","question_text":"How many different arrangements can be made using all three distinct letters A, B and C?","options":["3","6","9","12"],"correct_answer":"6","marks":4,"negative_marks":1,"source":"Study Buddy Original","source_reference":"stage-1-original-bank","tags":["counting","permutations"],"content_type":"original_exam_style","rights_status":"study_buddy_owned","redistribution_allowed":true,"rights_holder":"Study Buddy","license":"Study Buddy original content"}
]