[
  {"question_id":"JEE-ADV-CHE-2026-000001","exam":"JEE Advanced","exam_year":2026,"subject":"Chemistry","chapter":"Chemical Bonding","topic":"Molecular Orbital Theory","difficulty":"Hard","question_type":"MCQ","question_text":"According to molecular orbital theory, the bond order of the H2 molecule is:","options":["0","0.5","1","2"],"correct_answer":"1","marks":3,"negative_marks":1,"source":"Study Buddy Original","source_reference":"stage-1-original-bank","tags":["molecular-orbitals","bond-order"],"content_type":"original_exam_style","rights_status":"study_buddy_owned","redistribution_allowed":true,"rights_holder":"Study Buddy","license":"Study Buddy original content"},
  {"question_id":"JEE-ADV-CHE-2026-000002","exam":"JEE Advanced","exam_year":2026,"subject":"Chemistry","chapter":"Thermodynamics","topic":"Gibbs Energy","difficulty":"Medium","question_type":"MCQ","question_text":"At constant temperature and pressure, a process is spontaneous when the Gibbs free-energy change is:","options":["Positive","Zero only","Negative","Always equal to enthalpy change"],"correct_answer":"Negative","marks":3,"negative_marks":1,"source":"Study Buddy Original","source_reference":"stage-1-original-bank","tags":["thermodynamics","gibbs-energy"],"content_type":"original_exam_style","rights_status":"study_buddy_owned","redistribution_allowed":true,"rights_holder":"Study Buddy","license":"Study Buddy original content"}
]
