[
  {"question_id":"KCET-PHY-2026-000001","exam":"KCET","exam_year":2026,"subject":"Physics","chapter":"Current Electricity","topic":"Ohm's Law","difficulty":"Easy","question_type":"MCQ","question_text":"A resistor of 6 ohm is connected across a 12 V source. The current through it is:","options":["0.5 A","2 A","6 A","72 A"],"correct_answer":"2 A","marks":1,"negative_marks":0.25,"source":"Study Buddy Original","source_reference":"stage-1-original-bank","tags":["current-electricity","ohms-law"],"content_type":"original_exam_style","rights_status":"study_buddy_owned","redistribution_allowed":true,"rights_holder":"Study Buddy","license":"Study Buddy original content"},
  {"question_id":"KCET-PHY-2026-000002","exam":"KCET","exam_year":2026,"subject":"Physics","chapter":"Ray Optics","topic":"Lens Formula","difficulty":"Medium","question_type":"MCQ","question_text":"A convex lens has focal length 20 cm. An object is placed 40 cm in front of it. The image is formed at:","options":["10 cm","20 cm","40 cm","80 cm"],"correct_answer":"40 cm","marks":1,"negative_marks":0.25,"source":"Study Buddy Original","source_reference":"stage-1-original-bank","tags":["ray-optics","lens"],"content_type":"original_exam_style","rights_status":"study_buddy_owned","redistribution_allowed":true,"rights_holder":"Study Buddy","license":"Study Buddy original content"},
  {"question_id":"KCET-PHY-2026-000003","exam":"KCET","exam_year":2026,"subject":"Physics","chapter":"Motion in a Straight Line","topic":"Average Speed","difficulty":"Easy","question_type":"MCQ","question_text":"A car travels 60 km in 2 hours. Its average speed is:","options":["20 km/h","30 km/h","40 km/h","120 km/h"],"correct_answer":"30 km/h","marks":1,"negative_marks":0.25,"source":"Study Buddy Original","source_reference":"stage-1-original-bank","tags":["kinematics","average-speed"],"content_type":"original_exam_style","rights_status":"study_buddy_owned","redistribution_allowed":true,"rights_holder":"Study Buddy","license":"Study Buddy original content"},
  {"question_id":"KCET-PHY-2026-000004","exam":"KCET","exam_year":2026,"subject":"Physics","chapter":"Work, Energy and Power","topic":"Kinetic Energy","difficulty":"Medium","question_type":"MCQ","question_text":"If the speed of a body is doubled, its kinetic energy becomes:","options":["Half","Double","Four times","Unchanged"],"correct_answer":"Four times","marks":1,"negative_marks":0.25,"source":"Study Buddy Original","source_reference":"stage-1-original-bank","tags":["work-energy","kinetic-energy"],"content_type":"original_exam_style","rights_status":"study_buddy_owned","redistribution_allowed":true,"rights_holder":"Study Buddy","license":"Study Buddy original content"}
]