[
  {"question_id":"BITSAT-CHE-2026-000001","exam":"BITSAT","exam_year":2026,"subject":"Chemistry","chapter":"Atomic Structure","topic":"Quantum Numbers","difficulty":"Easy","question_type":"MCQ","question_text":"Which quantum number primarily determines the shape of an orbital?","options":["Principal quantum number n","Azimuthal quantum number l","Magnetic quantum number m","Spin quantum number s"],"correct_answer":"Azimuthal quantum number l","marks":1,"negative_marks":0,"source":"Study Buddy original exam-style question","tags":["original","BITSAT-style","atomic structure"],"content_type":"original_exam_style","rights_status":"study_buddy_owned","redistribution_allowed":true,"rights_holder":"Study Buddy"},
  {"question_id":"BITSAT-CHE-2026-000002","exam":"BITSAT","exam_year":2026,"subject":"Chemistry","chapter":"Thermodynamics","topic":"Enthalpy","difficulty":"Medium","question_type":"MCQ","question_text":"For an exothermic reaction carried out at constant pressure, the enthalpy change is generally:","options":["Positive","Negative","Zero","Always equal to internal energy"],"correct_answer":"Negative","marks":1,"negative_marks":0,"source":"Study Buddy original exam-style question","tags":["original","BITSAT-style","thermodynamics"],"content_type":"original_exam_style","rights_status":"study_buddy_owned","redistribution_allowed":true,"rights_holder":"Study Buddy"},
  {"question_id":"BITSAT-CHE-2026-000003","exam":"BITSAT","exam_year":2026,"subject":"Chemistry","chapter":"Chemical Bonding","topic":"Hybridization","difficulty":"Easy","question_type":"MCQ","question_text":"The hybridization of carbon in methane, CH4, is:","options":["sp","sp2","sp3","d2sp3"],"correct_answer":"sp3","marks":1,"negative_marks":0,"source":"Study Buddy original exam-style question","tags":["original","BITSAT-style","hybridization"],"content_type":"original_exam_style","rights_status":"study_buddy_owned","redistribution_allowed":true,"rights_holder":"Study Buddy"},
  {"question_id":"BITSAT-CHE-2026-000004","exam":"BITSAT","exam_year":2026,"subject":"Chemistry","chapter":"Equilibrium","topic":"pH","difficulty":"Medium","question_type":"MCQ","question_text":"At 25 degrees C, a neutral aqueous solution has pH approximately equal to:","options":["0","1","7","14"],"correct_answer":"7","marks":1,"negative_marks":0,"source":"Study Buddy original exam-style question","tags":["original","BITSAT-style","pH"],"content_type":"original_exam_style","rights_status":"study_buddy_owned","redistribution_allowed":true,"rights_holder":"Study Buddy"},
  {"question_id":"BITSAT-CHE-2026-000005","exam":"BITSAT","exam_year":2026,"subject":"Chemistry","chapter":"Redox Reactions","topic":"Oxidation Number","difficulty":"Medium","question_type":"MCQ","question_text":"The oxidation number of sulfur in H2SO4 is:","options":["+2","+4","+6","-2"],"correct_answer":"+6","marks":1,"negative_marks":0,"source":"Study Buddy Original","source_reference":"stage-1-original-bank","tags":["redox","oxidation-number"],"content_type":"original_exam_style","rights_status":"study_buddy_owned","redistribution_allowed":true,"rights_holder":"Study Buddy","license":"Study Buddy original content"},
  {"question_id":"BITSAT-CHE-2026-000006","exam":"BITSAT","exam_year":2026,"subject":"Chemistry","chapter":"Organic Chemistry - Some Basic Principles","topic":"IUPAC Nomenclature","difficulty":"Easy","question_type":"MCQ","question_text":"The IUPAC name of CH3CH2OH is:","options":["Methanol","Ethanol","Propanol","Ethanal"],"correct_answer":"Ethanol","marks":1,"negative_marks":0,"source":"Study Buddy Original","source_reference":"stage-1-original-bank","tags":["organic-chemistry","IUPAC"],"content_type":"original_exam_style","rights_status":"study_buddy_owned","redistribution_allowed":true,"rights_holder":"Study Buddy","license":"Study Buddy original content"}
]