[
  {"question_id":"SAT-MAT-2026-000001","exam":"SAT","exam_year":2026,"subject":"SAT Math","chapter":"Algebra","topic":"Linear Equations","difficulty":"Easy","question_type":"Grid-In","question_text":"If 3x + 7 = 22, what is the value of x?","options":[],"correct_answer":"5","marks":1,"negative_marks":0,"source":"Study Buddy Original","source_reference":"stage-1-original-bank","tags":["linear-equations","algebra"],"content_type":"original_exam_style","rights_status":"study_buddy_owned","redistribution_allowed":true,"rights_holder":"Study Buddy","license":"Study Buddy original content"},
  {"question_id":"SAT-MAT-2026-000002","exam":"SAT","exam_year":2026,"subject":"SAT Math","chapter":"Problem Solving and Data Analysis","topic":"Percentages","difficulty":"Medium","question_type":"MCQ","question_text":"A price is increased by 20% and then decreased by 20%. Compared with the original price, the final price is:","options":["4% lower","Equal","4% higher","8% lower"],"correct_answer":"4% lower","marks":1,"negative_marks":0,"source":"Study Buddy Original","source_reference":"stage-1-original-bank","tags":["percentages","data-analysis"],"content_type":"original_exam_style","rights_status":"study_buddy_owned","redistribution_allowed":true,"rights_holder":"Study Buddy","license":"Study Buddy original content"},
  {"question_id":"SAT-MAT-2026-000003","exam":"SAT","exam_year":2026,"subject":"SAT Math","chapter":"Advanced Math","topic":"Quadratic Equations","difficulty":"Medium","question_type":"MCQ","question_text":"If x^2 - 5x + 6 = 0, which of the following is the sum of the roots?","options":["2","3","5","6"],"correct_answer":"5","marks":1,"negative_marks":0,"source":"Study Buddy Original","source_reference":"stage-1-original-bank","tags":["quadratic","algebra"],"content_type":"original_exam_style","rights_status":"study_buddy_owned","redistribution_allowed":true,"rights_holder":"Study Buddy","license":"Study Buddy original content"},
  {"question_id":"SAT-MAT-2026-000004","exam":"SAT","exam_year":2026,"subject":"SAT Math","chapter":"Problem Solving and Data Analysis","topic":"Mean","difficulty":"Easy","question_type":"MCQ","question_text":"The mean of 4, 7, 9, and 10 is:","options":["6","7","7.5","8"],"correct_answer":"7.5","marks":1,"negative_marks":0,"source":"Study Buddy Original","source_reference":"stage-1-original-bank","tags":["statistics","mean"],"content_type":"original_exam_style","rights_status":"study_buddy_owned","redistribution_allowed":true,"rights_holder":"Study Buddy","license":"Study Buddy original content"},
  {"question_id":"SAT-MAT-2026-000005","exam":"SAT","exam_year":2026,"subject":"SAT Math","chapter":"Geometry and Trigonometry","topic":"Area of Triangle","difficulty":"Easy","question_type":"MCQ","question_text":"A triangle has base 10 and height 6. What is its area?","options":["16","30","60","120"],"correct_answer":"30","marks":1,"negative_marks":0,"source":"Study Buddy Original","source_reference":"stage-1-original-bank","tags":["geometry","area"],"content_type":"original_exam_style","rights_status":"study_buddy_owned","redistribution_allowed":true,"rights_holder":"Study Buddy","license":"Study Buddy original content"},
  {"question_id":"SAT-MAT-2026-000006","exam":"SAT","exam_year":2026,"subject":"SAT Math","chapter":"Algebra","topic":"Systems of Equations","difficulty":"Medium","question_type":"MCQ","question_text":"If x + y = 10 and x - y = 4, what is x?","options":["3","6","7","14"],"correct_answer":"7","marks":1,"negative_marks":0,"source":"Study Buddy Original","source_reference":"stage-1-original-bank","tags":["systems","algebra"],"content_type":"original_exam_style","rights_status":"study_buddy_owned","redistribution_allowed":true,"rights_holder":"Study Buddy","license":"Study Buddy original content"},
  {"question_id":"SAT-MAT-2026-000007","exam":"SAT","exam_year":2026,"subject":"SAT Math","chapter":"Problem Solving and Data Analysis","topic":"Ratios","difficulty":"Easy","question_type":"MCQ","question_text":"The ratio of red marbles to blue marbles is 2:3. If there are 15 blue marbles, how many red marbles are there?","options":["6","8","10","12"],"correct_answer":"10","marks":1,"negative_marks":0,"source":"Study Buddy Original","source_reference":"stage-1-original-bank","tags":["ratios","data-analysis"],"content_type":"original_exam_style","rights_status":"study_buddy_owned","redistribution_allowed":true,"rights_holder":"Study Buddy","license":"Study Buddy original content"},
  {"question_id":"SAT-MAT-2026-000008","exam":"SAT","exam_year":2026,"subject":"SAT Math","chapter":"Geometry and Trigonometry","topic":"Circle Area","difficulty":"Easy","question_type":"MCQ","question_text":"A circle has radius 3. What is its area in terms of pi?","options":["3pi","6pi","9pi","18pi"],"correct_answer":"9pi","marks":1,"negative_marks":0,"source":"Study Buddy Original","source_reference":"stage-1-original-bank","tags":["geometry","circles"],"content_type":"original_exam_style","rights_status":"study_buddy_owned","redistribution_allowed":true,"rights_holder":"Study Buddy","license":"Study Buddy original content"}
]