[
  {"question_id":"JEE-ADV-MAT-2026-000001","exam":"JEE Advanced","exam_year":2026,"subject":"Mathematics","chapter":"Complex Numbers","topic":"Modulus","difficulty":"Medium","question_type":"MCQ","question_text":"If z = 3 + 4i, then |z| is:","options":["3","4","5","7"],"correct_answer":"5","marks":3,"negative_marks":1,"source":"Study Buddy Original","source_reference":"stage-1-original-bank","tags":["complex-numbers","modulus"],"content_type":"original_exam_style","rights_status":"study_buddy_owned","redistribution_allowed":true,"rights_holder":"Study Buddy","license":"Study Buddy original content"},
  {"question_id":"JEE-ADV-MAT-2026-000002","exam":"JEE Advanced","exam_year":2026,"subject":"Mathematics","chapter":"Differential Calculus","topic":"Derivative","difficulty":"Medium","question_type":"MCQ","question_text":"For f(x) = x^3 - 3x, the value of f'(2) is:","options":["3","6","9","12"],"correct_answer":"9","marks":3,"negative_marks":1,"source":"Study Buddy Original","source_reference":"stage-1-original-bank","tags":["derivatives","calculus"],"content_type":"original_exam_style","rights_status":"study_buddy_owned","redistribution_allowed":true,"rights_holder":"Study Buddy","license":"Study Buddy original content"}
]
