[
  {"question_id":"JEE-MAIN-MAT-2026-000001","exam":"JEE Main","exam_year":2026,"subject":"Mathematics","chapter":"Quadratic Equations","topic":"Roots","difficulty":"Easy","question_type":"MCQ","question_text":"If the roots of x^2 - 5x + 6 = 0 are alpha and beta, what is alpha + beta?","options":["2","3","5","6"],"correct_answer":"5","marks":4,"negative_marks":1,"source":"Study Buddy Original","source_reference":"stage-1-original-bank","tags":["quadratic-equations","roots"],"content_type":"original_exam_style","rights_status":"study_buddy_owned","redistribution_allowed":true,"rights_holder":"Study Buddy","license":"Study Buddy original content"},
  {"question_id":"JEE-MAIN-MAT-2026-000002","exam":"JEE Main","exam_year":2026,"subject":"Mathematics","chapter":"Sequences and Series","topic":"Arithmetic Progression","difficulty":"Medium","question_type":"MCQ","question_text":"The 10th term of the arithmetic progression 3, 7, 11, 15, ... is:","options":["35","39","43","47"],"correct_answer":"39","marks":4,"negative_marks":1,"source":"Study Buddy Original","source_reference":"stage-1-original-bank","tags":["ap","sequences"],"content_type":"original_exam_style","rights_status":"study_buddy_owned","redistribution_allowed":true,"rights_holder":"Study Buddy","license":"Study Buddy original content"},
  {"question_id":"JEE-MAIN-MAT-2026-000003","exam":"JEE Main","exam_year":2026,"subject":"Mathematics","chapter":"Trigonometry","topic":"Trigonometric Ratios","difficulty":"Easy","question_type":"MCQ","question_text":"If sin theta = 3/5 and theta is acute, then cos theta is:","options":["2/5","3/5","4/5","5/3"],"correct_answer":"4/5","marks":4,"negative_marks":1,"source":"Study Buddy Original","source_reference":"stage-1-original-bank","tags":["trigonometry","ratios"],"content_type":"original_exam_style","rights_status":"study_buddy_owned","redistribution_allowed":true,"rights_holder":"Study Buddy","license":"Study Buddy original content"}
]
