[
  {"question_id":"BITSAT-MAT-2026-000001","exam":"BITSAT","exam_year":2026,"subject":"Mathematics","chapter":"Binomial Theorem","topic":"Middle Term","difficulty":"Medium","question_type":"MCQ","question_text":"In the expansion of (x + 1)^4, the coefficient of x^2 is:","options":["2","4","6","8"],"correct_answer":"6","marks":1,"negative_marks":0,"source":"Study Buddy original exam-style question","tags":["original","BITSAT-style","binomial theorem"],"content_type":"original_exam_style","rights_status":"study_buddy_owned","redistribution_allowed":true,"rights_holder":"Study Buddy"},
  {"question_id":"BITSAT-MAT-2026-000002","exam":"BITSAT","exam_year":2026,"subject":"Mathematics","chapter":"Differential Calculus","topic":"Basic Differentiation","difficulty":"Easy","question_type":"MCQ","question_text":"If y = x^3 + 2x, then dy/dx at x = 1 is:","options":["3","4","5","6"],"correct_answer":"5","marks":1,"negative_marks":0,"source":"Study Buddy original exam-style question","tags":["original","BITSAT-style","differentiation"],"content_type":"original_exam_style","rights_status":"study_buddy_owned","redistribution_allowed":true,"rights_holder":"Study Buddy"},
  {"question_id":"BITSAT-MAT-2026-000003","exam":"BITSAT","exam_year":2026,"subject":"Mathematics","chapter":"Complex Numbers","topic":"Modulus","difficulty":"Easy","question_type":"MCQ","question_text":"If z = 3 + 4i, then the modulus of z is:","options":["3","4","5","7"],"correct_answer":"5","marks":1,"negative_marks":0,"source":"Study Buddy original exam-style question","tags":["original","BITSAT-style","complex-numbers"],"content_type":"original_exam_style","rights_status":"study_buddy_owned","redistribution_allowed":true,"rights_holder":"Study Buddy"},
  {"question_id":"BITSAT-MAT-2026-000004","exam":"BITSAT","exam_year":2026,"subject":"Mathematics","chapter":"Matrices","topic":"Determinant","difficulty":"Medium","question_type":"MCQ","question_text":"The determinant of [[1, 2], [3, 4]] is:","options":["-2","-1","2","10"],"correct_answer":"-2","marks":1,"negative_marks":0,"source":"Study Buddy original exam-style question","tags":["original","BITSAT-style","matrices"],"content_type":"original_exam_style","rights_status":"study_buddy_owned","redistribution_allowed":true,"rights_holder":"Study Buddy"},
  {"question_id":"BITSAT-MAT-2026-000005","exam":"BITSAT","exam_year":2026,"subject":"Mathematics","chapter":"Sequences and Series","topic":"Arithmetic Progression","difficulty":"Easy","question_type":"MCQ","question_text":"The 10th term of the AP 2, 5, 8, 11, ... is:","options":["26","29","32","35"],"correct_answer":"29","marks":1,"negative_marks":0,"source":"Study Buddy Original","source_reference":"stage-1-original-bank","tags":["sequences","AP"],"content_type":"original_exam_style","rights_status":"study_buddy_owned","redistribution_allowed":true,"rights_holder":"Study Buddy","license":"Study Buddy original content"},
  {"question_id":"BITSAT-MAT-2026-000006","exam":"BITSAT","exam_year":2026,"subject":"Mathematics","chapter":"Trigonometric Functions","topic":"Trigonometric Ratios","difficulty":"Medium","question_type":"MCQ","question_text":"If tan theta = 3/4 and theta is acute, then sec theta is:","options":["3/5","4/5","5/4","5/3"],"correct_answer":"5/4","marks":1,"negative_marks":0,"source":"Study Buddy Original","source_reference":"stage-1-original-bank","tags":["trigonometry","trigonometric-ratios"],"content_type":"original_exam_style","rights_status":"study_buddy_owned","redistribution_allowed":true,"rights_holder":"Study Buddy","license":"Study Buddy original content"}
]