[
  {"question_id":"MHT-CET-PHY-2026-000001","exam":"MHT-CET","exam_year":2026,"subject":"Physics","chapter":"Electrostatics","topic":"Coulomb's Law","difficulty":"Medium","question_type":"MCQ","question_text":"If the distance between two point charges is doubled, the magnitude of the electrostatic force between them becomes:","options":["Four times","Two times","One-fourth","Unchanged"],"correct_answer":"One-fourth","marks":1,"negative_marks":0.25,"source":"Study Buddy Original","source_reference":"stage-1-original-bank","tags":["electrostatics","coulombs-law"],"content_type":"original_exam_style","rights_status":"study_buddy_owned","redistribution_allowed":true,"rights_holder":"Study Buddy","license":"Study Buddy original content"},
  {"question_id":"MHT-CET-PHY-2026-000002","exam":"MHT-CET","exam_year":2026,"subject":"Physics","chapter":"Semiconductors","topic":"Diode","difficulty":"Easy","question_type":"MCQ","question_text":"A p-n junction diode conducts appreciable current most readily when it is:","options":["Reverse biased","Forward biased","Unbiased only","Connected to an AC source only"],"correct_answer":"Forward biased","marks":1,"negative_marks":0.25,"source":"Study Buddy Original","source_reference":"stage-1-original-bank","tags":["semiconductors","diode"],"content_type":"original_exam_style","rights_status":"study_buddy_owned","redistribution_allowed":true,"rights_holder":"Study Buddy","license":"Study Buddy original content"},
  {"question_id":"MHT-CET-PHY-2026-000003","exam":"MHT-CET","exam_year":2026,"subject":"Physics","chapter":"Gravitation","topic":"Acceleration Due to Gravity","difficulty":"Easy","question_type":"MCQ","question_text":"Near the Earth's surface, the acceleration due to gravity is approximately:","options":["0.98 m/s^2","9.8 m/s^2","98 m/s^2","980 m/s^2"],"correct_answer":"9.8 m/s^2","marks":1,"negative_marks":0.25,"source":"Study Buddy Original","source_reference":"stage-1-original-bank","tags":["gravitation","g"],"content_type":"original_exam_style","rights_status":"study_buddy_owned","redistribution_allowed":true,"rights_holder":"Study Buddy","license":"Study Buddy original content"},
  {"question_id":"MHT-CET-PHY-2026-000004","exam":"MHT-CET","exam_year":2026,"subject":"Physics","chapter":"Thermal Properties of Matter","topic":"Linear Expansion","difficulty":"Medium","question_type":"MCQ","question_text":"A metal rod of length 2 m has coefficient of linear expansion 1.0 x 10^-5 per degree C. For a temperature rise of 100 degree C, its increase in length is:","options":["0.0002 m","0.001 m","0.002 m","0.02 m"],"correct_answer":"0.002 m","marks":1,"negative_marks":0.25,"source":"Study Buddy Original","source_reference":"stage-1-original-bank","tags":["thermal-expansion","linear-expansion"],"content_type":"original_exam_style","rights_status":"study_buddy_owned","redistribution_allowed":true,"rights_holder":"Study Buddy","license":"Study Buddy original content"},
  {"question_id":"MHT-CET-PHY-2026-000005","exam":"MHT-CET","exam_year":2026,"subject":"Physics","chapter":"Current Electricity","topic":"Ohm's Law","difficulty":"Easy","question_type":"MCQ","question_text":"A potential difference of 12 V is applied across a 4 ohm resistor. The current through the resistor is:","options":["2 A","3 A","4 A","48 A"],"correct_answer":"3 A","marks":1,"negative_marks":0.25,"source":"Study Buddy Original","source_reference":"stage-1-original-bank","tags":["current-electricity","ohms-law"],"content_type":"original_exam_style","rights_status":"study_buddy_owned","redistribution_allowed":true,"rights_holder":"Study Buddy","license":"Study Buddy original content"},
  {"question_id":"MHT-CET-PHY-2026-000006","exam":"MHT-CET","exam_year":2026,"subject":"Physics","chapter":"Wave Optics","topic":"Young's Double Slit Experiment","difficulty":"Medium","question_type":"MCQ","question_text":"In Young's double-slit experiment, the fringe width is directly proportional to:","options":["Slit separation","Wavelength","Square of wavelength","Inverse of screen distance"],"correct_answer":"Wavelength","marks":1,"negative_marks":0.25,"source":"Study Buddy Original","source_reference":"stage-1-original-bank","tags":["wave-optics","YDSE","interference"],"content_type":"original_exam_style","rights_status":"study_buddy_owned","redistribution_allowed":true,"rights_holder":"Study Buddy","license":"Study Buddy original content"}
]