[
  {"question_id":"BITSAT-PHY-2026-000001","exam":"BITSAT","exam_year":2026,"subject":"Physics","chapter":"Current Electricity","topic":"Electrical Power","difficulty":"Easy","question_type":"MCQ","question_text":"A 10 ohm resistor carries a current of 2 A. The power dissipated in the resistor is:","options":["5 W","20 W","40 W","100 W"],"correct_answer":"40 W","marks":3,"negative_marks":1,"source":"Study Buddy Original","source_reference":"stage-1-original-bank","tags":["current-electricity","power"],"content_type":"original_exam_style","rights_status":"study_buddy_owned","redistribution_allowed":true,"rights_holder":"Study Buddy","license":"Study Buddy original content"},
  {"question_id":"BITSAT-PHY-2026-000002","exam":"BITSAT","exam_year":2026,"subject":"Physics","chapter":"Waves","topic":"Wave Speed","difficulty":"Medium","question_type":"MCQ","question_text":"A wave has frequency 50 Hz and wavelength 2 m. Its speed is:","options":["25 m/s","50 m/s","100 m/s","200 m/s"],"correct_answer":"100 m/s","marks":3,"negative_marks":1,"source":"Study Buddy Original","source_reference":"stage-1-original-bank","tags":["waves","wave-speed"],"content_type":"original_exam_style","rights_status":"study_buddy_owned","redistribution_allowed":true,"rights_holder":"Study Buddy","license":"Study Buddy original content"},
  {"question_id":"BITSAT-PHY-2026-000003","exam":"BITSAT","exam_year":2026,"subject":"Physics","chapter":"Kinematics","topic":"Uniform Acceleration","difficulty":"Easy","question_type":"MCQ","question_text":"A particle starts from rest and accelerates uniformly at 2 m/s^2. Its speed after 5 s is:","options":["2 m/s","5 m/s","10 m/s","25 m/s"],"correct_answer":"10 m/s","marks":3,"negative_marks":1,"source":"Study Buddy Original","source_reference":"stage-1-original-bank","tags":["kinematics","acceleration"],"content_type":"original_exam_style","rights_status":"study_buddy_owned","redistribution_allowed":true,"rights_holder":"Study Buddy","license":"Study Buddy original content"},
  {"question_id":"BITSAT-PHY-2026-000004","exam":"BITSAT","exam_year":2026,"subject":"Physics","chapter":"Electrostatics","topic":"Electric Potential","difficulty":"Medium","question_type":"MCQ","question_text":"The electric potential due to a positive point charge at a finite distance is:","options":["Always negative","Always positive","Always zero","Dependent only on the test charge"],"correct_answer":"Always positive","marks":3,"negative_marks":1,"source":"Study Buddy Original","source_reference":"stage-1-original-bank","tags":["electrostatics","potential"],"content_type":"original_exam_style","rights_status":"study_buddy_owned","redistribution_allowed":true,"rights_holder":"Study Buddy","license":"Study Buddy original content"}
]