[
  {"question_id":"SAT-RW-2026-000001","exam":"SAT","exam_year":2026,"subject":"SAT Reading and Writing","chapter":"Standard English Conventions","topic":"Subject-Verb Agreement","difficulty":"Easy","question_type":"MCQ","question_text":"The collection of scientific articles ___ on the library website.","options":["are available","is available","were available","have available"],"correct_answer":"is available","marks":1,"negative_marks":0,"source":"Study Buddy original exam-style question","tags":["original","SAT-style","grammar"],"content_type":"original_exam_style","rights_status":"study_buddy_owned","redistribution_allowed":true,"rights_holder":"Study Buddy"},
  {"question_id":"SAT-RW-2026-000002","exam":"SAT","exam_year":2026,"subject":"SAT Reading and Writing","chapter":"Expression of Ideas","topic":"Transitions","difficulty":"Medium","question_type":"MCQ","question_text":"The experiment produced results that differed from the researchers' prediction. ___, the researchers repeated the experiment to verify the finding.","options":["For example","Nevertheless","Therefore","Meanwhile"],"correct_answer":"Therefore","marks":1,"negative_marks":0,"source":"Study Buddy original exam-style question","tags":["original","SAT-style","transitions"],"content_type":"original_exam_style","rights_status":"study_buddy_owned","redistribution_allowed":true,"rights_holder":"Study Buddy"},
  {"question_id":"SAT-RW-2026-000003","exam":"SAT","exam_year":2026,"subject":"SAT Reading and Writing","chapter":"Standard English Conventions","topic":"Punctuation","difficulty":"Easy","question_type":"MCQ","question_text":"The researchers reached one important conclusion ___ the new material reduced heat loss significantly.","options":[",",":",";","no punctuation"],"correct_answer":":","marks":1,"negative_marks":0,"source":"Study Buddy original exam-style question","tags":["original","SAT-style","punctuation"],"content_type":"original_exam_style","rights_status":"study_buddy_owned","redistribution_allowed":true,"rights_holder":"Study Buddy"},
  {"question_id":"SAT-RW-2026-000004","exam":"SAT","exam_year":2026,"subject":"SAT Reading and Writing","chapter":"Information and Ideas","topic":"Central Ideas","difficulty":"Medium","question_type":"MCQ","question_text":"A city study found that rooftop gardens can lower building temperatures, provide habitat for insects, and reduce stormwater runoff. Which choice best states the central idea?","options":["Rooftop gardens can provide several environmental benefits.","Most city buildings should be painted green.","Insects prefer rooftops to parks.","Stormwater runoff occurs only in large cities."],"correct_answer":"Rooftop gardens can provide several environmental benefits.","marks":1,"negative_marks":0,"source":"Study Buddy original exam-style question","tags":["original","SAT-style","central idea"],"content_type":"original_exam_style","rights_status":"study_buddy_owned","redistribution_allowed":true,"rights_holder":"Study Buddy"},
  {"question_id":"SAT-RW-2026-000005","exam":"SAT","exam_year":2026,"subject":"SAT Reading and Writing","chapter":"Standard English Conventions","topic":"Subject-Verb Agreement","difficulty":"Medium","question_type":"MCQ","question_text":"Neither the laboratory assistants nor the lead researcher ___ available for the interview.","options":["were","are","was","have been"],"correct_answer":"was","marks":1,"negative_marks":0,"source":"Study Buddy original exam-style question","tags":["original","SAT-style","grammar"],"content_type":"original_exam_style","rights_status":"study_buddy_owned","redistribution_allowed":true,"rights_holder":"Study Buddy"},
  {"question_id":"SAT-RW-2026-000006","exam":"SAT","exam_year":2026,"subject":"SAT Reading and Writing","chapter":"Expression of Ideas","topic":"Transitions","difficulty":"Medium","question_type":"MCQ","question_text":"The first trial produced promising results. ___, the researchers cautioned that a larger sample was needed before drawing firm conclusions.","options":["Similarly","However","For instance","As a result"],"correct_answer":"However","marks":1,"negative_marks":0,"source":"Study Buddy original exam-style question","tags":["original","SAT-style","transitions"],"content_type":"original_exam_style","rights_status":"study_buddy_owned","redistribution_allowed":true,"rights_holder":"Study Buddy"}
]