[
  {
    "question_id": "MHT-CET-CHE-2026-000001",
    "exam": "MHT-CET",
    "exam_year": 2026,
    "subject": "Chemistry",
    "chapter": "Chemical Kinetics",
    "topic": "Rate Constant",
    "difficulty": "Easy",
    "question_type": "MCQ",
    "question_text": "For a first-order reaction, the unit of the rate constant is:",
    "options": ["mol L^-1 s^-1", "s^-1", "L mol^-1 s^-1", "mol^-1 L s^-1"],
    "correct_answer": "s^-1",
    "marks": 1,
    "negative_marks": 0,
    "source": "Study Buddy original exam-style question",
    "tags": ["original", "MHT-CET-style", "chemical kinetics"],
    "content_type": "original_exam_style",
    "rights_status": "study_buddy_owned",
    "redistribution_allowed": true,
    "rights_holder": "Study Buddy"
  },
  {
    "question_id": "MHT-CET-CHE-2026-000002",
    "exam": "MHT-CET",
    "exam_year": 2026,
    "subject": "Chemistry",
    "chapter": "Electrochemistry",
    "topic": "Oxidation and Reduction",
    "difficulty": "Easy",
    "question_type": "MCQ",
    "question_text": "Oxidation is best described as:",
    "options": ["Gain of electrons", "Loss of electrons", "Gain of neutrons", "Loss of protons"],
    "correct_answer": "Loss of electrons",
    "marks": 1,
    "negative_marks": 0,
    "source": "Study Buddy original exam-style question",
    "tags": ["original", "MHT-CET-style", "redox"],
    "content_type": "original_exam_style",
    "rights_status": "study_buddy_owned",
    "redistribution_allowed": true,
    "rights_holder": "Study Buddy"
  }
]
