[
  {"question_id":"JEE-ADV-PHY-2026-000001","exam":"JEE Advanced","exam_year":2026,"subject":"Physics","chapter":"Mechanics","topic":"Work Energy Theorem","difficulty":"Hard","question_type":"MCQ","question_text":"A particle of mass 2 kg moves along a line under a constant force of 6 N in the direction of motion. If its speed increases from 2 m/s to 5 m/s, the work done by the force is:","options":["21 J","27 J","42 J","54 J"],"correct_answer":"21 J","marks":3,"negative_marks":1,"source":"Study Buddy Original","source_reference":"stage-1-original-bank","tags":["work-energy","mechanics"],"content_type":"original_exam_style","rights_status":"study_buddy_owned","redistribution_allowed":true,"rights_holder":"Study Buddy","license":"Study Buddy original content"},
  {"question_id":"JEE-ADV-PHY-2026-000002","exam":"JEE Advanced","exam_year":2026,"subject":"Physics","chapter":"Electrostatics","topic":"Electric Potential","difficulty":"Hard","question_type":"MCQ","question_text":"Two identical positive point charges are placed symmetrically about the origin. At the origin, the electric field is zero. The electric potential at the origin is:","options":["Zero","Positive and non-zero","Negative and non-zero","Undefined"],"correct_answer":"Positive and non-zero","marks":3,"negative_marks":1,"source":"Study Buddy Original","source_reference":"stage-1-original-bank","tags":["electrostatics","potential","electric-field"],"content_type":"original_exam_style","rights_status":"study_buddy_owned","redistribution_allowed":true,"rights_holder":"Study Buddy","license":"Study Buddy original content"}
]
